{
  "token": "conf-5d1c0f7a",
  "toolName": "create_followup_task",
  "summary": {
    "key": "ai.present.write.createFollowupTask",
    "fallback": "Create follow-up task: 跟进辰光 45 万逾期订单回款",
    "params": { "title": "跟进辰光 45 万逾期订单回款" }
  },
  "arguments": { "customerId": 12, "title": "跟进辰光 45 万逾期订单回款" },
  "authorization": {
    "tool": "create_followup_task",
    "riskLevel": "R3",
    "riskStrategy": "confirmation",
    "requiresConfirmation": true,
    "checks": [
      { "name": "tool_enabled", "ok": true, "note": "治理策略已启用" },
      { "name": "risk_policy", "ok": true, "note": "风险级 R3（confirmation）→ 需人工确认" }
    ]
  },
  "impact": {
    "actions": 1,
    "targets": [{ "resultType": "crm_task", "count": 1 }]
  },
  "revokeClass": "local_compensate"
}
