{
  "token": "run-4f8a2c9e",
  "mode": "run",
  "impact": {
    "actions": 3,
    "targets": [
      { "resultType": "crm_task", "count": 2 },
      { "resultType": "contract", "count": 1 }
    ]
  },
  "run": {
    "runId": "run-4f8a2c9e",
    "riskLevel": "R3",
    "items": [
      {
        "toolName": "create_followup_task",
        "summary": {
          "key": "ai.present.write.createFollowupTask",
          "fallback": "Create follow-up task: 跟进辰光逾期回款",
          "params": { "title": "跟进辰光逾期回款" }
        },
        "riskLevel": "R3",
        "revokeClass": "local_compensate"
      },
      {
        "toolName": "create_followup_task",
        "summary": {
          "key": "ai.present.write.createFollowupTask",
          "fallback": "Create follow-up task: 回访蓝湾地产",
          "params": { "title": "回访蓝湾地产" }
        },
        "riskLevel": "R3",
        "revokeClass": "local_compensate"
      },
      {
        "toolName": "proxy_tool_settle_order",
        "summary": {
          "key": "ai.present.write.generic",
          "fallback": "Ran a write operation"
        },
        "riskLevel": "R3",
        "revokeClass": "governed_external"
      }
    ]
  }
}
